noun.person | (voter, nsubj)  | noun.cognition | (choice, obj) | opponents generally argued that the ballot couldn't give enough information about tax proposals for the voters to make an intelligent choice 
adj.all | (some, nsubj)  | noun.communication | (statement, obj) | it is impossible to get a fair trial when some of the defendants made statements involving themselves and others '' 
noun.person | (he, nsubj)  | noun.act | (attempt, obj) | as usual , he made no attempt to get in touch with carmine g de sapio , the manhattan leader 
noun.person | (leader, nsubj)  | noun.shape | (dent, obj) | the early southwest conference football leaders -- texas , arkansas and texas a & m -- made a big dent in the statistics last week 
noun.quantity | (19, nsubj)  | noun.group | (race, obj) | then last season the birds tumbled as low as 11-18 on may 19 before recovering to make a race of it and total 86 victories 
noun.person | (russell, nsubj)  | noun.cognition | (one, obj) | the living room has another scoop : jane russell will make one of her rare night club singing appearances there , opening jan 22 
noun.person | (loeb, nsubj)  | noun.communication | (arrangement, obj) | mrs arthur loeb is making arrangements for a reception ; ;
noun.person | (he, nsubj)  | noun.quantity | (suggestion, obj) | `` i hate to have these things come up again and again '' , dr jenkins commented as he made his suggestion 
noun.person | (taxpayer, nsubj)  | noun.communication | (appeal, obj) | about 70 north providence taxpayers made appeals to the board of tax assessors for a review of their 1961 tax assessments during the last two days at the town hall in centredale 
noun.artifact | (four, nsubj)  | noun.communication | (collection, obj) | thomas rotelli , head of rhode island incinerator service , inc , said four of the company's eight trucks were making collections with both newly hired and regular workers 
noun.person | (he, nsubj)  | noun.communication | (agreement, obj) | lee said he had told the jury that he made an agreement in april with stein to supply and supervise janitors in mccormick place 
noun.object | (murray, nsubj)  | noun.shape | (line, obj) | murray makes a complete line of ginning equipment except for driers and cleaners , and this machinery is purchased from a dallas-based firm 
noun.process | (increase, nsubj)  | noun.artifact | (equipment, obj) | the increase in mechanical harvesting of cotton makes cleaning and drying equipment a must for modern gin operation 
noun.person | (they, nsubj)  | noun.artifact | (saw, obj) | they make gin saws and deal in parts , supplies and some used gin machinery 
noun.location | (co, nsubj)  | noun.artifact | (equipment, obj) | the stacy co makes cleaning and drying equipment for sale largely in texas 
noun.act | (service, nsubj)  | noun.artifact | (saw, obj) | cotton belt gin service , inc of dallas makes gin saws and started here 14 years ago 
noun.person | (president, nsubj)  | noun.communication | (statement, obj) | the railroad president made the statement in an interview as the interstate commerce commission opened round 2 of its hearing into the c & o's request to control and then merge with the b & aj 
noun.person | (who, nsubj)  | noun.cognition | (reservation, obj) | and to encourage other churches to try their own programs , kern said this sunday's sessions -- including the free dinner -- will be open to anyone who makes reservations 
adj.all | (smallest, nsubj)  | noun.person | (they, nsubj) | `` it is a british austin , the smallest they make '' 
noun.person | (who, nsubj)  | noun.artifact | (trip, obj) | anticipated heavy traffic along the skyline drive failed to materialize yesterday , park rangers said , and those who made the trip got a leisurely view of the fall colors through skies swept clear of haze 
noun.location | (moscow, nsubj)  | noun.act | (inroad, obj) | the spirit served chiefly to lull the west while moscow made inroads into the middle east 
noun.person | (khrushchev, nsubj)  | noun.communication | (capital, obj) | premier khrushchev has made propaganda capital out of that fact and in the end got his summit meeting anyway 
noun.person | (president, nsubj)  | noun.act | (effort, obj) | finally , there was a wide area of agreement on the value of the president's making a final effort in the summit spotlight for a nuclear test accord 
noun.person | (man, nsubj)  | noun.cognition | (kind, obj) | a man does not make that kind of gamble if he suspects that one or more of the limited number of tenure positions is being reserved for members of the `` family '' 
noun.person | (they, nsubj)  | noun.event | (decision, obj) | competent teachers are well versed in the technique of leading students to pre-set conclusions without destroying the students' illusion that they are making their own decisions 
noun.artifact | (secretary, nsubj)  | noun.cognition | (report, obj) | at a closed-door session on capitol hill last week , secretary of state christian herter made his final report to the senate foreign relations committee on us affairs abroad 
noun.person | (he, nsubj)  | noun.communication | (speech, obj) | he is , of course , a segregationist , but he says he has never made an `` anti-negro '' speech 
noun.person | (man, nsubj)  | noun.act | (run, obj) | since 1927 , fewer than a dozen men have made serious runs at babe ruth's record and each , in turn , has been thwarted 
noun.person | (man, nsubj)  | noun.communication | (bid, obj) | always , in the abortive attacks upon ruth's record , one man alone -- a jimmy foxx ( 58 in 1932 ) or a hank greenberg ( 58 in 1938 ) or a hack wilson ( 56 in 1930 ) -- made the bid 
noun.person | (i, nsubj)  | noun.event | (play, obj) | `` when i've made a dumb play '' , he says , `` i don't want to talk to anyone 
noun.person | (who, nsubj)  | noun.artifact | (ensemble, obj) | the biggest single act would doubtless be staged by frankie himself : his inaugural wardrobe had been designed by hollywood couturier don loper , who regularly makes up ladies' ensembles 
noun.person | (thompson, nsubj)  | noun.communication | (headline, obj) | last week , in the german city of dusseldorf , g david thompson was making headlines that could well give pittsburgh pause 
noun.person | (he, nsubj)  | noun.phenomenon | (fortune, obj) | he made his fortune during world war 2 , when he took over a number of dying steel plants and kept them alive until the boom 
noun.location | (georgia, nsubj)  | noun.act | (reform, obj) | georgia has made some reforms , true 
noun.act | (service, nsubj)  | noun.person | (case, obj) | the park service makes an impressive ecological and statistical case for creating this new park 
noun.person | (he, nsubj)  | noun.cognition | (sense, obj) | he made good , plain american common sense and the house usually recognized it and acted upon it 
noun.group | (un, nsubj)  | noun.event | (progress, obj) | does this suggest that the congo is fit for nationhood or that un is making any progress whatever toward its goal of so making it ? ?
noun.act | (craft, nsubj)  | noun.act | (flight, obj) | the craft made the familiar unwelcome flight to havana , where , for some unknown reason , castro rushed to the airport to express mortification to the colombian foreign minister , a passenger , who is not an admirer of old ten o'clock shadow 
noun.group | (university, nsubj)  | noun.act | (contribution, obj) | the university can make a valuable contribution to the state's economic development through such a study 
noun.person | (they, nsubj)  | noun.act | (stick, obj) | even though headquarters actually have been moved into the chatham building , do they believe that they can make the new name stick ? ?
noun.person | (taylor, nsubj)  | noun.artifact | (trip, obj) | there was good reason for gen taylor to make an inspection trip at this time 
noun.Tops | (being, nsubj)  | noun.entity | (it, obj) | what we must have , if the united nations is to survive , is as nonpolitical , nonpartisan an organization at the top as human beings can make it , subject to no single nation's direction and subservient to no single nation's ambition 
noun.person | (i, nsubj)  | noun.person | (myself, obj) | for a while there was such shrill girlish commotion i couldn't have made myself heard if i'd had the equivalent of the message to garcia 
noun.attribute | (joke, nsubj)  | noun.person | (friend, obj) | jokes , cartoons and cynics to the contrary , mothers-in-law make good friends 
noun.person | (he, nsubj)  | noun.attribute | (use, obj) | mr podger had thanked him gravely , and now he made use of the advice 
noun.person | (he, nsubj)  | adj.all | (simple, obj) | he can often make the complex ridiculously simple , and vice versa 
noun.communication | (paper, nsubj)  | noun.act | (appearance, obj) | aug 4 , 1821 , nearly a century after benjamin franklin founded the pennsylvania gazette -- a century during which it had undergone several changes in ownership and a few brief suspensions in publication -- this paper made its first appearance as the saturday evening post 
noun.person | (lawyer, nsubj)  | noun.artifact | (trip, obj) | the right to leave the hoosegow any time to see a lawyer instead of waiting for a lawyer to make a trip to the prison 
noun.person | (you, nsubj)  | noun.act | (mistake, obj) | apologies are in order from anybody who said , `` are you sure you're not making a mistake '' ? ?
noun.act | (force, nsubj)  | noun.act | (start, obj) | the task force might make a start in washington with republican congressional leaders 
noun.person | (who, nsubj)  | noun.artifact | (boat, obj) | the guy who makes the motor boats may be a communist '' 
noun.group | (squad, nsubj)  | noun.possession | (way, obj) | however , the east providence rescue squad made its way through to my home in time of desperation 
noun.person | (he, nsubj)  | noun.artifact | (point, obj) | while i respect his sincere concern for peace , he made four points that i would like to question 
noun.artifact | (cafe, nsubj)  | noun.possession | (money, obj) | unfortunately the cafes might not make enough money to support themselves during the off season 
noun.person | (you, nsubj)  | noun.communication | (comment, obj) | in your editorial of sept 30 `` the smoldering congo '' you make the following comment : `` far too many states are following the russian example in refusing to pay their assessments 
noun.person | (they, nsubj)  | noun.cognition | (object, obj) | they make beautiful objects 
noun.act | (wrong, nsubj)  | noun.act | (right, obj) | i suppose i am missing some elementary point but i honestly cannot see how two wrongs can make a right ! !
noun.act | (wrong, nsubj)  | noun.act | (right, obj) | i repeat , two wrongs do not make a right 
noun.act | (union, nsubj)  | noun.person | (they, obj) | some time ago , however , mr khrushchev decided that when bigger bombs were made , the soviet union would make them 
noun.person | (enemy, nsubj)  | noun.act | (miscalculation, obj) | if this capacity had not failed them , they would see that their enemy has made a disastrous miscalculation 
noun.person | (he, nsubj)  | noun.act | (mistake, obj) | but to imitate an opponent when he has made the mistake of his life would be a new high in statesmanlike folly 
noun.person | (khrushchev, nsubj)  | noun.communication | (threat, obj) | so , while we properly inveigh against the new poisoning , history is not likely to justify the pose of righteousness which some in the west were so quick to assume when mr khrushchev made his cynical and irresponsible threat 
noun.group | (protestants, nsubj)  | noun.attribute | (use, obj) | speakers declared that protestants often make use of it , if , perhaps , by some other name 
noun.person | (communist, nsubj)  | noun.act | (mistake, obj) | the military in taiwan believe that the communists have made two mistakes , which , together , may prove fatal 
noun.person | (we, nsubj)  | noun.possession | (note, obj) | before memory , too , clouds over , let us make a note or two of what could be seen 
noun.person | (we, nsubj)  | noun.attribute | (grant, obj) | in the very week of our war against katanga , we make a $133 million grant to kwame nkrumah , who has just declared his solidarity with the communist bloc , and is busily turning his own country into a totalitarian dictatorship 
noun.person | (leader, nsubj)  | noun.communication | (noise, obj) | from this belief is derived the practical orientation of our policy on the `` uncommitted '' ( `` neutralist '' , `` contested '' ) nations , especially on those whose leaders make the most noise -- nehru , tito , nkrumah , sukarno , betancourt , etc 
noun.artifact | (newspaper, nsubj)  | noun.act | (mistake, obj) | a couple of days later a balletomane told me he had telephoned allied arts for ticket information and was told `` the newspapers had made a mistake '' 
noun.person | (moore, nsubj)  | noun.person | (master, obj) | furthermore , garry moore makes an ideal master of ceremonies 
noun.person | (who, nsubj)  | noun.communication | (debut, obj) | francois d'albert , hungarian-born violinist who made his new york debut three years ago , played a return engagement last night in judson hall 
noun.person | (he, nsubj)  | adj.all | (most, obj) | he made the most of the long brahmsian phrases , and by the directness and drive of his playing gave the work a handsome performance 
noun.person | (he, nsubj)  | adj.all | (many, obj) | he believed in making inspiring speeches and he made a great many 
noun.person | (i, nsubj)  | noun.communication | (mention, obj) | so i made no mention of air transport until we could get at least some of it '' 
noun.person | (he, nsubj)  | noun.act | (attempt, obj) | it is greatly to berman's credit that he made no attempt to outdo ray bolger 
noun.artifact | (bond, nsubj)  | noun.state | (box, obj) | such fascinating novelties in the score as the fugual treatment of `` on the side of the angels '' and `` politics and poker '' were handled splendidly , and i thought rudy bond and his band of tuneful ward-heelers made `` little tin box '' even better than it was done by the new york cast ; ;
noun.quantity | (couple, nsubj)  | noun.communication | (comedy, obj) | a couple of the males made good comedy , too -- jim hutton and frank gorshin 
noun.person | (he, nsubj)  | noun.process | (selection, obj) | did low decide to let well enough alone when he made his selections ? ?
noun.quantity | (handful, nsubj)  | noun.communication | (concert, obj) | a tiny handful never did make the concert 
noun.entity | (it, nsubj)  | noun.communication | (introduction, obj) | it also makes a fine introduction to the international art form with good examples of italian and english madrigals plus several french `` chansons '' 
noun.person | (i, nsubj)  | noun.communication | (observation, obj) | i make this observation about the lady , miss judy garland , because she brought up the subject herself in telling a story about a british female reporter who flattered her terribly in london recently and then wrote in the paper the next day :
noun.person | (who, nsubj)  | noun.act | (mistake, obj) | there also came a brief contretemps with the sound mixers who made the mistake of being overheard during a quiet moment near the conclusion of `` do it again '' , and she made the tart observation that `` i never saw so much moving about in an audience '' 
noun.person | (she, nsubj)  | noun.communication | (observation, obj) | there also came a brief contretemps with the sound mixers who made the mistake of being overheard during a quiet moment near the conclusion of `` do it again '' , and she made the tart observation that `` i never saw so much moving about in an audience '' 
noun.person | (he, nsubj)  | noun.communication | (comment, obj) | and he makes many interesting comments 
noun.communication | (copy, nsubj)  | noun.communication | (bid, obj) | he even buys a lot of the products he sees advertised -- despite the fact that the copy makes no special bid for his favor and sponsors rarely use any but white models in commercials 
noun.cognition | (amount, nsubj)  | noun.entity | (it, obj) | but no amount of head-tossing could make it so 
noun.person | (they, nsubj)  | noun.substance | (atom, obj) | protons and electrons bear opposite electrical charges which make them attract each other , and when they are joined they make up an atom of hydrogen -- the basic building block of matter 
noun.entity | (it, nsubj)  | noun.state | (effect, obj) | put to the service of lieder of schubert , brahms , strauss and wolf in a dramatical and musical way , it made its effect with ease and precision 
noun.location | (west, nsubj)  | noun.communication | (proposal, obj) | `` the west should make the central proposal ; ;
noun.location | (montgomery, nsubj)  | noun.act | (contribution, obj) | however , montgomery makes little contribution to leadership theory and practice 
noun.person | (drinker, nsubj)  | noun.act | (adjustment, obj) | but keys worries that the metrecal drinker will never make either the psychological or physiological adjustment to the idea of eating smaller portions of food 
noun.person | (we, nsubj)  | noun.attribute | (use, obj) | as a result , although we still make use of this distinction , there is much confusion as to the meaning of the basic terms employed 
noun.person | (who, nsubj)  | noun.communication | (pronouncement, obj) | if bultmann's own definition of myth is strictly adhered to ( and it is interesting that this is almost never done by those who make such pronouncements ) , the evidence is overwhelming that he does not at all exaggerate the extent to which the mythological concepts of traditional theology have become incredible and irrelevant 
noun.state | (need, nsubj)  | noun.attribute | (use, obj) | in the absence of a truly adequate conceptuality in which the gospel can be expressed , the unavoidable need to demythologize it makes use of whatever resources are at hand -- and this usually means one or another of the various forms of `` folk religion '' current in the situation 
noun.cognition | (liberalism, nsubj)  | noun.communication | (mark, obj) | a century ago , newman saw that liberalism ( what we now might call secularism ) would gradually but definitely make its mark on english protestantism , and that even high anglicanism would someday no longer be a `` serviceable breakwater against doctrinal errors more fundamental than its own '' 
noun.person | (doctor, nsubj)  | noun.act | (survey, obj) | one doctor made a careful survey of his patients and the reasons for their troubles , and he reported that 40% of them worried about things that never happened ; ;
noun.person | (scholar, nsubj)  | noun.artifact | (set, obj) | scholars made numbered sets of as many things as possible in nature , or assigned arbitrary numbers to individual things , in a fashion that seems to the modern scientific mind as downright nonsensical , and philosophical ideas based upon all this tended to stifle speculative thought in china for many centuries 
noun.Tops | (individual, nsubj)  | noun.event | (decision, obj) | the first thirty to sixty days after individuals make their decision will determine their interest and participation in the life of the church 
noun.person | (he, nsubj)  | noun.group | (appointment, obj) | if possible , he should make an appointment in order that all persons involved may be present 
noun.act | (congress, nsubj)  | noun.act | (law, obj) | the american constitution was historic at this point in providing that `` congress shall make no law respecting an establishment of religion or prohibiting the free exercise thereof '' 
noun.person | (i, nsubj)  | noun.cognition | (choice, obj) | but i can only make this choice because i believe that the risk need not increase , but may be deliberately reduced '' ( by precautions against accidents or by limiting war ? ?
noun.person | (child, nsubj)  | noun.attribute | (use, obj) | on their way to the heavenly city the children of god make use of the pax-ordo of the earthly city and acknowledge their share in responsibility for its preservation 
noun.group | (company, obj)  | noun.person | (we, nsubj) | and think , if we all knew this secret and we could pool our power , what a wonderful public utility company we would make 
noun.entity | (it, nsubj)  | noun.artifact | (trip, obj) | with martha's vineyard on one side and the open sea on the other , it makes an excellent trip of about three hours 
noun.person | (you, nsubj)  | noun.artifact | (stretch, obj) | you'll know when you've made the greatest stretch because your shoulder blades will touch ! !
noun.person | (you, nsubj)  | noun.act | (experiment, obj) | you should have a couple of training partners to stand by when you make your first experiments just for safety 
noun.person | (they, nsubj)  | noun.substance | (a, obj) | treat them right and they'll make a showing every month in the year except the frigid ones 
noun.person | (junior, nsubj)  | noun.artifact | (point, obj) | juniors who attend this chicago show should make a point to enter this class as it would be of great help to them 
noun.person | (you, nsubj)  | noun.communication | (mark, obj) | compress the assembly when you make the mark to show the location for `` b '' 
noun.feeling | (fury, nsubj)  | noun.act | (mistake, obj) | fury has made a few mistakes but looks like a wonderful prospect , with his impressive gait and stride which certainly make him cover the ground 
noun.person | (robinson, nsubj)  | noun.artifact | (rifle, obj) | at least five years ago , tom robinson of marlin made up an over/under double rifle for me in this caliber , using the now defunct model 90 action in 20-gauge size 
noun.animal | (marlin, nsubj)  | noun.act | (contribution, obj) | marlin has made two contributions to the harvest of new offerings 
noun.food | (peel, nsubj)  | noun.artifact | (dome, obj) | peel , core , and slice across enough apples to make a dome in the pie tin , and set aside 
noun.object | (milk, nsubj)  | noun.food | (dough, obj) | blend 2 cups biscuit mix with 2/3 cup milk to make a soft dough 
noun.cognition | (project, nsubj)  | noun.possession | (allowance, obj) | place mold or paper pattern on rolled clay and cut clay by holding knife in vertical position ( cut more pieces than required for project to make allowance for defects ; ;
noun.location | (frederick, nsubj)  | noun.artifact | (ride, obj) | colonel frederick w lander , impersonated , will again make his break-neck ride down the steep declivity of talbott's ( now college ) hill and thunder across the bridge to join colonel benjamin f kelley's ( west ) virginia infantry , then swarming through the streets in pursuit of the retreating confederates 
noun.person | (you, nsubj)  | noun.act | (trek, obj) | on the other hand , out-of-sight does not lead to out-of-mind when children cannot be easily observed and you have to make a long trek to reach the pool 
noun.group | (building, nsubj)  | noun.possession | (provision, obj) | if you can't see your way clear to have summer cooling included when building , by all means make provision for its easy adding later 
noun.artifact | (conditioner, nsubj)  | noun.attribute | (cool, obj) | as you know , a conditioner makes indoor air cool by pumping the heat out of it and then releasing this heat outdoors 
noun.communication | (person, nsubj)  | noun.communication | (judgment, obj) | it is too easy for the inexperienced person to make a quick judgment of a few values of the area and base a decision on these alone 
noun.communication | (stravinsky, nsubj)  | noun.act | (blunder, obj) | in all his miscalculations , stravinsky made the fatal historical blunder of presuming that he could transform other composers' inspirations -- representing many peoples , time periods and styles -- into his own music by warping the harmony , melody , or form , to verify his own experiments 
noun.person | (i, nsubj)  | noun.communication | (sketch, obj) | first i make preliminary watercolor sketches in quarter scale ( approximately af inches ) in which i pay particular attention to the design principles of three simple values -- the lightest light , the middle tone , and the darkest dark -- by reducing the forms of my subject to these large patterns 
noun.person | (i, nsubj)  | noun.attribute | (change, obj) | when this occurs , i make the change on the sketch or on the final watercolor -- if i have been working on a full sheet in the field 
noun.person | (i, nsubj)  | noun.attribute | (use, obj) | `` in addition to the usual tools , i make constant use of cleansing tissue , not only to wipe my brushes , but to mop up certain areas , to soften edges , and to open up lights in dark washes 
noun.group | (management, nsubj)  | noun.person | (mind, obj) | we have seen good new products shelved because no one had the assignment to develop such facts and plans -- and management couldn't make up its mind 
noun.body | (factor, nsubj)  | noun.communication | (difference, obj) | these factors can make the difference between waste and efficiency in any benefit program 
noun.person | (we, nsubj)  | noun.artifact | (application, obj) | `` we have made limited application of the ' parallel ladder ' plan 
noun.artifact | (sign, nsubj)  | noun.act | (appearance, obj) | signs of this type have already made their appearance in several larger cities , and others are on the way 
noun.artifact | (panel, nsubj)  | noun.artifact | (length, obj) | sixteen panels , each slightly more than 1-1/2 ft wide , make up the 25-ft length of the sign 
noun.shape | (channel, nsubj)  | noun.artifact | (construction, obj) | joined side by side , such channels make possible construction of continuous two-dimensional luminous areas up to 50 ft high and of unlimited width 
