noun.person | (you, nsubj)  | noun.state | (success, obj) | if within one year you can make a success out of the american , you can practically name your own salary thereafter 
noun.person | (he, nsubj)  | noun.attribute | (use, obj) | the outstanding example was in garibaldi and the thousand , where he made use of unpublished papers of lord john russell and english consular materials to reveal the motives which led the british government to permit garibaldi to cross the straits of messina 
noun.person | (i, nsubj)  | noun.person | (friend, obj) | as the field on which my tent was pitched was a favorite natural playground for the kids of the neighborhood , i had made many friends among them , taking part in their after-school games and trying desperately to translate grimm's fairy tales into an understandable french as we gathered around the fire in front of the tent 
noun.person | (i, nsubj)  | noun.entity | (it, obj) | i've had a trying day and i just can't make it out again '' , i told them 
noun.person | (they, nsubj)  | noun.event | (time, obj) | most of the rebels got away since they could make better time through the stiff brush than their naked pursuers 
noun.person | (i, nsubj)  | noun.possession | (money, obj) | i might not make any money but i'd sure have patients '' 
noun.person | (they, nsubj)  | noun.animal | (test, obj) | they made the tests and came to fred ; ;
noun.person | (mama, nsubj)  | noun.food | (joint, obj) | a few years before his death papa had agreed with mama to make a joint will with her in which it would be provided that in the event of the death of either of them an accounting would be made to their children whereby each child would receive a bequest of $5000 cash 
noun.person | (mind, nsubj)  | noun.communication | (music, obj) | as i have said , words from tennyson remain ever in my memory : `` that mind and soul , according well , may make one music as before '' 
noun.act | (congress, nsubj)  | noun.possession | (restitution, obj) | after complimenting morgan and the riflemen and saying he was praising them to congress , too , the ardent frenchman added he felt that congress should make some financial restitution to the widow and family of morris , but that he knew morgan realized how long such action usually required , if it was done at all 
noun.person | (he, nsubj)  | noun.act | (charge, obj) | nogaret is hardly an impartial witness , and even he did not make his charges against boniface until the latter was dead , but there is some truth in what he said and more in what he did not say 
noun.person | (he, nsubj)  | noun.attribute | (pretense, obj) | and yet he made no pretense about it ; ;
noun.person | (philip, nsubj)  | noun.communication | (alliance, obj) | the defeat and death of adolf of nassau at the hands of albert of habsburg also worked to the disadvantage of the english , for all the efforts to revive the anti-french coalition came to nothing when philip made an alliance with the new king of the romans 
noun.person | (merchant, nsubj)  | noun.person | (companion, obj) | these chatty merchants made amusing and instructive traveling companions , for their business took them to all four corners of the globe , and florentine gossip had already reached a high stage of development as even a cursory glance at the inferno will prove 
noun.entity | (it, nsubj)  | noun.communication | (statement, obj) | i have said before how difficult it is to make any precise statements with regard to the character of the greek and elizabethan public 
noun.artifact | (adam, nsubj)  | noun.attribute | (pretense, obj) | in all fairness it must be admitted that adams made no pretense at being an impartial historian 
noun.entity | (it, nsubj)  | noun.communication | (difference, obj) | it made no difference that most evidence points to an opposite conclusion 
noun.person | (i, nsubj)  | noun.act | (mistake, obj) | while sk did not like dylan thomas , i liked his poems very much , but i made the mistake of telling dylan thomas so , whereupon he said to me , `` i suppose you think you know all about me '' 
noun.person | (he, nsubj)  | noun.communication | (retreat, obj) | before he made that retreat , he telephoned earl blackman in kansas city and asked him to come to europe with him 
noun.entity | (what, nsubj)  | noun.event | (phenomenon, obj) | what makes the current phenomenon unique is that so many science-fiction writers have reversed a trend and turned to writing works critical of the impact of science and technology on human life 
noun.person | (i, nsubj)  | noun.animal | (soldier, obj) | just as i know i would make a bad soldier even though i cannot sincerely call myself a pacifist , so too i would not be either a hangman by profession or , if i could avoid it , even a member of a hanging jury 
noun.communication | (legend, nsubj)  | noun.communication | (impression, obj) | the revolution in jazz that took place around 1949 , the evolution from the `` bebop '' school of dizzy gillespie to the `` cool '' sound of miles davis and lennie tristano , lee konitz , and the whole legend of charlie parker , had made an impression on many academic and literary men 
noun.person | (he, nsubj)  | noun.act | (effort, obj) | rexroth may sometimes achieve an effective juxtaposition , but he rarely makes any effort to capture any jazz `` feeling '' in the text of his poems , relying on his very competent musicians to supply this feeling 
noun.person | (he, nsubj)  | noun.act | (assault, obj) | he had made an assault once with 180 men 
noun.person | (they, nsubj)  | noun.entity | (it, obj) | they made it , killed every last one of the krauts , took the village on schedule 
noun.group | (firm, nsubj)  | noun.communication | (item, obj) | these problems frequently arise where a firm is making items for the government not directly along the lines of its normal civilian business or where the government specifications require operations that the firm did not understand when it undertook the contract 
noun.group | (sba, nsubj)  | noun.artifact | (inventory, obj) | sba can make complete facilities inventories of all small business concerns in labor surplus areas within budgetary and staff limitations 
noun.group | (sba, nsubj)  | noun.communication | (loan, obj) | sba makes loans to individual small business firms , providing them with financing when it is not otherwise available through private lending sources on reasonable terms 
noun.person | (we, nsubj)  | noun.act | (assistance, obj) | second , we can make assistance for particular projects conditional on the consistency of such projects with the program 
noun.act | (pool, nsubj)  | noun.event | (progress, obj) | the motor pool has made exceptional progress in automotive management including establishment of cost billing systems , records keeping , analyses of vehicle use , and effecting economies in vehicle operation 
noun.person | (they, nsubj)  | adj.all | (more, obj) | only four towns indicated that they made any more than a normal effort to list property of this kind 
noun.group | (personnel, nsubj)  | noun.act | (visit, obj) | we received 76 out-of-state visitors interested in investigating rhode island's industrial advantages , and industrial division personnel made 55 out-of-state follow-up visits 
noun.person | (who, nsubj)  | noun.act | (sacrifice, obj) | it is the purpose of armed forces day to give americans an opportunity to honor men of the armed forces , those who have made the supreme sacrifice , those who remain to preserve our security 
noun.artifact | (secretary, nsubj)  | noun.cognition | (report, obj) | the secretary shall make reports to the president and the congress at the beginning of each regular session of the action taken or instituted by him under the provisions of this act and of prospective action during the ensuing year 
noun.artifact | (secretary, nsubj)  | noun.possession | (payment, obj) | subject to the limitations of this act , the secretary shall make stabilization payments to small domestic producers upon presentation of evidence satisfactory to him of their status as such producers and of the sale by them of newly mined ores , or concentrates produced therefrom , as provided in this act 
noun.person | (receiver, nsubj)  | noun.possession | (assignment, obj) | if a receiver or trustee for any such partnership or corporation , duly appointed by a court of competent jurisdiction in the united states , makes an assignment of the claim , or any part thereof , with respect to which an award is made , or makes an assignment of such award , or any part thereof , payment shall be made to the assignee , as his interest may appear ; ;
noun.person | (who, nsubj)  | noun.artifact | (application, obj) | any person who makes application for any such payment shall be held to have consented to all the provisions of this title 
noun.body | (corporation, nsubj)  | noun.cognition | (acquisition, obj) | no corporation engaged in commerce shall acquire , directly or indirectly , the whole or any part of the stock or other share capital of another corporation engaged also in commerce , where the effect of such acquisition may be to substantially lessen competition between the corporation whose stock is so acquired and the corporation making the acquisition , or to restrain such commerce in any section or community , or tend to create a monopoly of any line of commerce 
noun.person | (he, nsubj)  | noun.communication | (statement, obj) | in his answer thereto , he advised the board that he had made no such statement in 1956 , and asserted that his only claim to `` pioneering '' was in 1952 
noun.person | (he, nsubj)  | noun.communication | (claim, obj) | he did receive a resume of it -- the same that was furnished the appeal board -- and he made no claim of its inaccuracy 
noun.group | (commission, nsubj)  | noun.possession | (assignment, obj) | with the existence of these many factors , some of them variable , it obviously has never been and is not now possible for the commission to make assignments of am stations on a case-to-case basis which will insure against any interference in any circumstances 
noun.person | (you, nsubj)  | noun.artifact | (application, obj) | you may apply for such an extension by filing form 2688 , application for extension of time to file , with the district director of internal revenue for your district , or you may make your application in a letter 
noun.person | (you, nsubj)  | noun.communication | (request, obj) | you should make any request for an extension early so that if it is refused , your return may still be on time 
noun.cognition | (problem, nsubj)  | noun.state | (demand, obj) | for , granting that there are great present-day problems to be solved , these problems make great demands ; ;
noun.person | (they, nsubj)  | noun.quantity | (naught, obj) | nevertheless , they made naught of marx's prophecy that capitalism would never pay the `` workers '' -- to use marx's word -- more than a subsistence wage , with the consequence that increased productivity must inevitably find its way into the capitalists' pockets with the result , in turn , that the gap between the rich and the poor would irrevocably widen and the misery of the poor increase 
noun.artifact | (brown, nsubj)  | noun.communication | (entry, obj) | it must have been with some pleasure and relief that on september 12 , 1848 , joseph brown made the momentous entry in his job book , in his characteristically cryptic style , `` lucian sharpe came to work for me this day as an apprentice '' 
noun.communication | (process, nsubj)  | noun.act | (manufacture, obj) | this process made the economical manufacture of gears questionable until some way could be found to permit the repeated re-sharpening of gear tooth cutters without the loss of the precision form 
noun.cognition | (division, nsubj)  | noun.event | (progress, obj) | our patterson moos research division has made further very encouraging progress in development of fuel cells 
noun.person | (one, nsubj)  | noun.communication | (guess, obj) | one cannot make a very satisfactory guess about the micrometeorite flux in space 
noun.person | (she, nsubj)  | noun.person | (mind, obj) | once she has made up her mind , the queen starts out by constructing , in her chosen abode , a small `` floor '' of dried grass or some woolly material 
adj.all | (each, nsubj)  | noun.animal | (cocoon, obj) | each now makes a tough , papery cocoon and pupates 
noun.person | (i, nsubj)  | noun.cognition | (sense, obj) | i cannot make sense out of the figures for post maturity growth ; ;
noun.state | (lack, nsubj)  | noun.communication | (difference, obj) | obviously , very slight changes in p do not change the probabilities much , and a slight lack of independence may not make an appreciable difference 
noun.person | (we, nsubj)  | noun.communication | (remark, obj) | with the above results we can make the following remarks about the graph of f 
noun.group | (country, nsubj)  | noun.act | (stride, obj) | but these countries have made big strides toward developing the necessary human and social overhead capital ; ;
noun.group | (faith, nsubj)  | noun.attribute | (fortitude, obj) | his religious beliefs provide him with plausible explanations for many conditions which cause him great concern , and his religious faith makes possible fortitude , equanimity , and consolation , enabling him to endure colossal misfortune , fear , frustration , uncertainty , suffering , evil , and danger 
noun.person | (we, nsubj)  | adj.all | (best, obj) | but the greater part of semester time was actually centered around the attitudes : `` so we are married -- now how do we make the best of it '' ? ?
noun.person | (principal, nsubj)  | noun.state | (rating, obj) | school principals and guidance workers made ratings of the various neighborhoods and the research team made independent observations of houses and dwelling areas 
noun.group | (team, nsubj)  | noun.communication | (observation, obj) | school principals and guidance workers made ratings of the various neighborhoods and the research team made independent observations of houses and dwelling areas 
noun.state | (lack, nsubj)  | noun.act | (effort, obj) | children scoring high in compulsivity were those who gave evidence of tension or emotionality in situations where there was lack of organization or conformity to standards and expectations , or who made exaggerated efforts to achieve these goals 
noun.person | (compulsive, nsubj)  | noun.act | (score, obj) | it is interesting to note that medium compulsives in the unstructured schools made the lowest achievement scores ( although not significantly lower ) 
noun.person | (who, nsubj)  | noun.act | (mistake, obj) | entirely concerned with efficiency , he was merciless in criticizing people who made mistakes , condemning them to too great an extent 
noun.person | (i, nsubj)  | noun.event | (decision, obj) | on being criticized for his arbitrary behavior -- he answered : `` i have to make decisions 
noun.person | (manager, nsubj)  | noun.act | (error, obj) | eighteen errors were located , and then the director asked each individual to vote whether or not they felt that this manager had made the particular errors 
noun.person | (he, nsubj)  | noun.act | (error, obj) | they were asked to vote `` true '' if they thought they had seen him make the error , `` false '' if they thought he had not ; ;
noun.person | (she, nsubj)  | noun.communication | (speech, obj) | thus in mary wrote an account of the trip first strong stress on mary marks mary as the first in a series of people who wrote accounts of the trip , strong stress on wrote marks the writing as the first of a series of actions of mary's concerned with an account of her trip ( about which she may later have made speeches , for example ) , and strong stress on trip makes the trip the first of a series of subjects about which mary wrote accounts 
noun.entity | (it, nsubj)  | noun.act | (contribution, obj) | as a restatement it makes only a small contribution to knowledge of igbo 
adj.all | (most, nsubj)  | noun.person | (itself, obj) | we expected , in short , that most of the world would make itself over in our image and that it would be relatively simple , from such a position , to deal with the localized aberrations of the soviet union '' 
noun.communication | (bulletin, nsubj)  | noun.communication | (process, obj) | periodic bulletins of the accomplishment in each province made the registration process into a kind of competition among provincial officials 
noun.act | (training, nsubj)  | noun.animal | (worker, obj) | vocational educators do not claim that school training alone makes skilled workers , but it provides the essential groundwork for developing skills 
noun.state | (state, nsubj)  | noun.attribute | (use, obj) | few states make effective use of their existing vocational education programs or funds for the purpose of attracting new industry 
adj.all | (first, nsubj)  | noun.act | (survey, obj) | all the manuals for setting up vocational courses stress the importance of first making a local survey of skill needs , of estimating the growth of local jobs , and of consulting with local employers on the types of courses and their content 
noun.person | (observer, nsubj)  | noun.communication | (graph, obj) | odd-lot index observers then make graphs of the data according to their particular statistical recipe 
noun.person | (they, nsubj)  | noun.cognition | (average, obj) | they might , for example , plot it exactly as is , or they might make ten day moving averages of it , or longer moving averages , or they might simply plot the ratio of odd-lot purchases to odd-lot sales 
noun.time | (majority, nsubj)  | noun.possession | (profit, obj) | try to imagine a market in which only a minority of traders would lose , and the majority would make consistent profits 
noun.person | (author, nsubj)  | noun.communication | (claim, obj) | while there may be several such industries to which the model of this paper is applicable , the authors make particular claim of relevance to the explanation of the course of wages and prices in the steel industry of the united states since world war 2 
noun.person | (he, nsubj)  | noun.entity | (it, obj) | he made it ; ;
noun.cognition | (purpose, nsubj)  | noun.act | (union, obj) | the justice's elaborate examination of the legislative history of the provision in question suggests that congress' purpose was merely to make unions suable 
noun.person | (respondent, nsubj)  | noun.attribute | (recommendation, obj) | is the respondent making a recommendation for his own benefit , for the benefit of his industry , for the benefit of a specific government department or service , for the benefit of the defense program , for the benefit of small business , or for the benefit of the taxpayers ? ?
noun.person | (they, nsubj)  | noun.event | (decision, obj) | do they make class-biased decisions ? ?
noun.person | (educator, nsubj)  | noun.cognition | (choice, obj) | the problem arises , if it does arise , when the educator has to make a choice or a decision within the area of his professional competence , but which bears some relation to the social structure 
verb.contact | (impel, nsubj)  | noun.cognition | (kind, obj) | nevertheless , because the cost section has felt impelled to make some kind of a distribution of total costs , it has apportioned this residue , which it sometimes calls `` burden '' , among the units of carload traffic on a basis ( partly ton , partly ton-mile ) which is concededly quite arbitrary from the standpoint of cost determination 
noun.cognition | (one, nsubj)  | noun.communication | (statement, obj) | let us take a set of circumstances in which i happen to be interested on the legislative side and in which i think every one of us might naturally make such a statement 
noun.event | (accident, nsubj)  | noun.communication | (difference, obj) | indeed , we should say , on the contrary , that the accident of our later discovery made no difference whatever to the badness of the animal's pain , that it would have been every whit as bad whether a chance passer-by happened later to discover the body and feel repugnance or not 
noun.person | (we, nsubj)  | noun.communication | (remark, obj) | if anyone asked us , after we made the remark that the suffering was a bad thing , whether we should think it relevant to what we said to learn that the incident had never occurred and no pain had been suffered at all , we should say that it made all the difference in the world , that what we were asserting to be bad was precisely the suffering we thought had occurred back there , that if this had not occurred , there was nothing left to be bad , and that our assertion was in that case mistaken 
noun.entity | (it, nsubj)  | noun.communication | (difference, obj) | if anyone asked us , after we made the remark that the suffering was a bad thing , whether we should think it relevant to what we said to learn that the incident had never occurred and no pain had been suffered at all , we should say that it made all the difference in the world , that what we were asserting to be bad was precisely the suffering we thought had occurred back there , that if this had not occurred , there was nothing left to be bad , and that our assertion was in that case mistaken 
noun.person | (we, nsubj)  | noun.act | (mistake, obj) | the suggestion that in saying something evil had occurred we were after all making no mistake , because we had never meant anyhow to say anything about the past suffering , seems to me merely frivolous 
noun.person | (we, nsubj)  | noun.entity | (it, obj) | when we come upon the rabbit and make our remark about its suffering being a bad thing , we presumably make it with some feeling ; ;
noun.person | (we, nsubj)  | noun.communication | (remark, obj) | and suppose that the circumstances have now so changed that the feeling with which we made the remark in the first place has faded 
noun.person | (we, nsubj)  | noun.entity | (it, obj) | when we repeat the remark that such suffering was a bad thing , the feeling with which we made it last week may be at or near the vanishing point , but if we were asked whether we meant to say what we did before , we should certainly answer yes 
noun.person | (we, nsubj)  | noun.artifact | (point, obj) | we should say that we made our point with feeling the first time and little or no feeling the second time , but that it was the same point we were making 
noun.cognition | (belief, nsubj)  | noun.cognition | (sense, obj) | but on the theory before us such a belief would not make sense 
noun.person | (they, nsubj)  | noun.cognition | (investigation, obj) | quite naturally , they make the investigation , first , by prohibiting the patient from making any movements at all and then , later , by repeating it and allowing the patient to move in any way he wanted to 
noun.person | (he, nsubj)  | noun.artifact | (collage, obj) | picasso says that he himself had already made his first collage toward the end of 1911 , when he glued a piece of imitation-caning oilcloth to a painting on canvas 
noun.entity | (it, nsubj)  | noun.communication | (difference, obj) | ( it makes no real difference that braque's collage is on paper and eked out in charcoal , while picasso's is on canvas and eked out in oil 
noun.state | (stream, nsubj)  | noun.act | (appearance, obj) | before losing itself in the sands of the 19th century , the grand stream of italian renaissance architectural decoration made a last appearance in the brumidi frescos of the capitol rotunda in washington 
noun.person | (we, nsubj)  | noun.entity | (it, obj) | we made it by doerner's recipe , five parts thoroughly washed cheese curd to one of lime putty ; ;
noun.person | (they, nsubj)  | noun.substance | (adhesive, obj) | ground together they made a strong adhesive , which became waterproof in drying 
noun.person | (they, nsubj)  | noun.event | (entrance, obj) | the same could be said for the song to which they make their entrance in the final scene 
noun.person | (he, nsubj)  | noun.possession | (note, obj) | mrs hardy records that `` at the end of november ( 1881 ) he makes a note of an intention to resume poetry as soon as possible '' ( early life , p 188 ) ; ;
noun.entity | (it, nsubj)  | noun.communication | (statement, obj) | it is competent in the sense that it makes a coherent statement without violating the rules of the sonnet form , but it is entirely undistinguished and entirely unlike hardy 
noun.person | (he, nsubj)  | noun.artifact | (point, obj) | combellack argues further , and here he makes his main point , that once the iliad and the odyssey are thought formulaic poems composed for an audience accustomed to formulaic poetry , homeric critics are deprived of an entire domain they previously found arable 
noun.communication | (statement, nsubj)  | noun.possession | (provision, obj) | certain autocoder statements make provision for more parameters than may be contained in the operand ( columns 21 - 75 ) of a single line on the autocoder coding sheet 
noun.artifact | (objective, nsubj)  | noun.process | (supplies, obj) | the basic objectives in each instance are to make available supplies of food during the intervals between harvesting or slaughter , to minimize losses resulting from the action of microorganisms and insects , and to make it possible to transport foods from the area of harvest or production to areas of consumption 
noun.entity | (it, nsubj)  | noun.act | (assessment, obj) | furthermore , it has made an exact assessment of the removal mechanisms possible 
noun.substance | (foam, nsubj)  | noun.act | (appearance, obj) | since the mid 1950s , when urethane foam first made its appearance in the american market , growth has been little short of fantastic 
