noun.event | (revolution, nsubj)  | verb.social | (handle, nsubj) | the revolution now under way in materials handling makes this much easier 
noun.person | (they, nsubj)  | noun.act | (charge, obj) | of these , 376 said they make no extra charge for strapping in standard units , because they save enough on mechanized carloading to offset their strapping cost 
noun.person | (man, nsubj)  | noun.group | (team, obj) | we found that three men -- two carpenters and a helper -- can put up wall panels or trusses more economically than four men -- because four men don't make two teams ; ;
noun.person | (they, nsubj)  | noun.group | (team, obj) | they make one inefficient three-men-and-a-helper team 
noun.artifact | (stud, nsubj)  | noun.person | (carpenter, obj) | so if a green stud makes a carpenter or a drywall finisher or anybody else waste even 20 seconds , the green stud becomes more expensive than a dry stud 
noun.person | (macarthur, nsubj)  | noun.communication | (remark, obj) | but consider , if you can bear it , what might have happened if macarthur , for some perverse , undaunted reason , had made the same remark to an eskimo girl in eskimo 
noun.person | (who, obj)  | noun.person | (mind, obj) | a brisk , amusing man , apparently constructed on an ingenious system of spring-joints attuned to the same peppery rhythm as his mind , smith began his academic career teaching speech to barnard girls -- a project considerably enlivened by his devotion to a recording about `` a young rat named arthur , who never could make up his mind '' 
noun.person | (they, nsubj)  | noun.act | (raid, obj) | on november 24th , they had made a raid on la maddalena 
noun.person | (I, nsubj)  | noun.act | (appearance, obj) | two days later , some 30 of them had struck at a convoy off bougie , sinking a troopship -- and it had been that very night that the me-210 had made its first appearance 
noun.food | (bomber, nsubj)  | noun.event | (hell, obj) | in that interval , the german bombers made a hell of bari harbor 
noun.act | (carrot, nsubj)  | noun.entity | (it, obj) | the carrots sometimes don't make it through the winter ; ;
noun.person | (you, nsubj)  | noun.person | (toast, obj) | `` you can't make french toast with whole-wheat bread '' , was an early complaint 
adj.all | (some, nsubj)  | noun.artifact | (chair, obj) | some make beautiful chairs , cabinets , chests , doll houses , etc 
noun.person | (you, nsubj)  | noun.cognition | (grade, obj) | just let the rejection slips fall where they may , and keep on plugging , and finally you will make the grade 
noun.person | (who, nsubj)  | noun.attribute | (use, obj) | so far in history man has been too greatly over-occupied with projecting things into his environment rather than first creating the sort of person who can make the highest use of the things he has created 
noun.person | (huxley, nsubj)  | noun.artifact | (point, obj) | sir julian huxley in his book uniqueness of man makes the novel point that just as man is unique in being the only animal which requires a long period of infancy and childhood under family protection , so is he the only animal who has a long period after the decline of his procreativity 
noun.event | (progress, nsubj)  | noun.person | (he, nsubj) | he can take security from the fact that the progress he has made by his gentle approach will not be lost 
noun.person | (wife, nsubj)  | noun.state | (demand, obj) | or a wife may make sudden demands that she be courted , flattered or coaxed , simply because she needs her ego lifted 
noun.animal | (sitter, nsubj)  | noun.communication | (comment, obj) | the mediums with whom the parapsychology foundation is working in this experiment are in a waking or only slightly dissociated state , so that the sitter can make comments , ask and answer questions , instead of talking with a `` control '' who speaks through an entranced sensitive 
noun.animal | (sitter, nsubj)  | noun.food | (date, obj) | here the absent sitter makes a `` date '' with a communicator ( someone close to him who is deceased ) , asking him to `` come in '' at a certain hour , when a channel will be open for him 
adj.all | (sensitive, nsubj)  | noun.act | (hit, obj) | an interested sitter may think the sensitive has made a `` hit '' , describing something accurately for him , but can he really be sure that another sitter , hearing the same statement , would not apply it subjectively to his own circumstances ? ?
noun.person | (she, nsubj)  | adj.all | (most, obj) | it is possible to find out in which categories most of her correct statements fall , and where she makes most of her `` hits '' 
noun.artifact | (type, nsubj)  | noun.communication | (difference, obj) | soil type , drainage , or degree of slope can make the difference between good crops and poor ones 
noun.entity | (it, nsubj)  | noun.act | (effort, obj) | interruptions came largely from the bench , which numerous times rebuked the attorney general for letting his witnesses run on , though it , too , made no serious effort to choke off the flow 
noun.person | (nazi, nsubj)  | noun.attribute | (use, obj) | but if the trial did not expose the special nazi mania so deadly to jews as well as to anyone upon whom it happened to light , neither did it warn very effectively against the ordinary anti-semitism of which the nazis made such effective use in germany and wherever else they could find it 
noun.event | (trial, nsubj)  | noun.act | (effort, obj) | ought not an edifying trial have made every effort to demonstrate this once and for all by showing how representative types of `` mere '' anti-semites were drawn step by step into the program of skull-bashings and gassings ? ?
noun.group | (denomination, nsubj)  | noun.communication | (pronouncement, obj) | since then , many protestant denominations have made separate pronouncements , in which they not only approved birth control , but declared it at times to be a religious duty 
noun.group | (settlement, nsubj)  | noun.act | (leap, obj) | thus at the same time that william henry harrison was preparing to pacify the aborigines of indiana territory and winning fame at the battle of tippecanoe , anglo-saxon settlement made a great leap into the center of the north american continent to the west of the american agricultural frontier 
noun.person | (he, nsubj)  | noun.group | (deal, obj) | he conducted it with less diplomacy and more spontaneous violence than the sicilians , but he had his huge north side portion to exploit and he made a great deal of money 
noun.communication | (staff, nsubj)  | noun.cognition | (determination, obj) | its staff makes a preliminary determination of the epicenter of the quake and alerts tide stations near the epicenter for a tsunami 
noun.attribute | (station, nsubj)  | noun.cognition | (calculation, obj) | while accounts of the progress of the tsunami came in from various points in the pacific ( midway reported it was covered with nine feet of water ) , the hawaiian station made its calculations and notified the military services and the police that the first big wave would arrive at honolulu at 23:30 greenwich time 
noun.person | (we, nsubj)  | noun.person | (wave, obj) | in the search for oil and gas , we make similar waves under controlled conditions with dynamite and learn from them where there are buried rock structures favorable to the accumulation of these resources 
noun.location | (co, nsubj)  | noun.person | (fool, obj) | in combat , helping your co make a fool of himself might mean getting yourself killed 
noun.group | (cavalry, nsubj)  | noun.communication | (mark, obj) | although it was at the battle of the little horn , about which more words have been written than any other battle in american history , that the 7th cavalry first made its mark in history , the regiment was ten years old by then 
noun.artifact | (remedy, nsubj)  | noun.communication | (noise, obj) | a traditional lao explanation is that the moon was being swallowed by a toad , and the remedy was to make all possible noise , ideally with firearms 
noun.person | (we, nsubj)  | noun.communication | (column, obj) | with our company of soldiers , we made one long column of reddish dust 
noun.person | (boy, nsubj)  | noun.act | (exertion, obj) | in their first two years in high school , jewish boys in this town make strenuous exertions to win positions on the school teams 
noun.artifact | (chalk, nsubj)  | noun.food | (paste, obj) | for galled breasts , the mother should shave into half a cup of fresh unsalted lard enough white chalk to make a paste 
noun.person | (friend, nsubj)  | noun.artifact | (poultice, obj) | a sympathetic friend made poultices of raw potato parings , which she said was the best and quickest way to draw out the `` heat '' 
noun.group | (people, nsubj)  | noun.group | (tea, obj) | to cure fungus growths on mouth or hands people made a strong tea by using a handful of sassafras bark in a quart of water 
noun.person | (who, nsubj)  | noun.communication | (blend, obj) | he may also be the one who makes and bottles the best blends -- sound wines from vineyards generally in his own district 
noun.animal | (palfrey, nsubj)  | noun.person | (mind, obj) | palfrey had already made up his mind that he would allow the men , but not the women , to choose freely whether or not to go north for freedom 
noun.person | (who, nsubj)  | noun.event | (break, obj) | walton , who soon made a break from journalism to become one of the capital's leading semi-abstract painters , vows that he and kennedy never once discussed art in those days 
noun.location | (kennedy, nsubj)  | noun.act | (inspection, obj) | kennedy made a midnight inspection of the square 
noun.person | (who, nsubj)  | noun.group | (headquarters, obj) | it is known that morse did associate with a group of itinerant horse traders who made their headquarters at westport , a town not far from fall river 
noun.group | (police, nsubj)  | noun.act | (attempt, obj) | police did make an attempt to check on morse's alibi 
noun.person | (one, nsubj)  | noun.quantity | (word, obj) | also lucy and winslow had a private contest to see which one could make the most words from the letters in `` importunately '' 
noun.animal | (lucy, nsubj)  | noun.possession | (record, obj) | there is reason to suppose that lucy would have made a record as publicly distinguished as her brother had it not been that her mother's death occurred just as she was about to enter college 
noun.attribute | (interest, nsubj)  | noun.artifact | (work, obj) | she spoke also with deep thankfulness of the many individuals and agencies whose interest and efforts through the years had made the work so fruitful in results 
noun.person | (i, nsubj)  | noun.act | (attempt, obj) | i make no attempt to measure the enduring satisfaction and material well-being of a man who went to work on graduation from high school and was highly successful in the business which he entered 
noun.food | (spice, nsubj)  | noun.cognition | (group, obj) | the common spices , flavorings , and condiments make up this group 
noun.artifact | (pack, nsubj)  | noun.event | (bend, obj) | the pack had made a bend to the north , swinging back toward the reef , and kearton and ulyate could hear them faintly 
noun.person | (he, nsubj)  | noun.possession | (way, obj) | with great difficulty he made his way from his native hungary to geneva to renew his contacts as a member of the provisional committee for the world council of churches 
noun.person | (we, nsubj)  | noun.event | (advance, obj) | we shall not make a decisive advance in the ecumenical movement until such a church begins to see itself not merely as a haven of comfort and peace but as a base of christian witness and mission to the world 
noun.artifact | (movement, nsubj)  | noun.event | (advance, obj) | as long as the congregation regards the church as `` our '' church , or the minister thinks of it as `` my '' church , just so long the ecumenical movement will make no significant advance 
noun.person | (attorney, nsubj)  | noun.state | (demand, obj) | the suit , as we have seen , came before the courts when patent attorneys , inventors , and laymen were making mounting demands for reforms in the american patent system 
noun.person | (landlord, nsubj)  | noun.possession | (profit, obj) | the landlords make a tidy profit by raising the rent , chopping up the rooms , and all but dispensing with the upkeep ; ;
noun.person | (negro, nsubj)  | noun.act | (move, obj) | it is a notion which contains a gratuitous insult , implying , as it does , that negroes can make no move unless they are manipulated 
noun.person | (who, obj)  | noun.artifact | (escape, obj) | a posse is formed and pursues the robbers , who , having made their escape , are whooping it up with some wild , wild women in a honky-tonk hide-out 
noun.person | (negro, nsubj)  | noun.possession | (way, obj) | negroes , puerto ricans , and rural newcomers are slowly making their way into the cities 
noun.person | (he, nsubj)  | noun.act | (effort, obj) | when ambassador mikhail menshikov took it over in 1957 from georgi zaroubin , he made a determined effort to change this idea 
noun.person | (he, nsubj)  | noun.event | (decision, obj) | he makes the momentous decision 
noun.person | (president, nsubj)  | noun.event | (decision, obj) | all could help the president make his decision 
noun.person | (he, nsubj)  | noun.act | (appearance, obj) | after he had spent the first three years in new york as associate conductor , at toscanini's invitation , of the nbc orchestra , he made numerous guest appearances throughout the united states and latin america 
noun.person | (he, nsubj)  | noun.communication | (debut, obj) | since 1944 he has also conducted regularly at the san francisco opera , where he made his debut with a memorable performance of verdi's falstaff 
noun.person | (who, nsubj)  | noun.group | (nation, obj) | it is well then that in this hour both of `` national peril '' and of `` national opportunity '' we can take counsel with the men who made the nation 
noun.person | (who, nsubj)  | noun.phenomenon | (fortune, obj) | `` i have just come from viewing a man who had made the fortune of his country , but now is working all night in order to support his family '' , he reflected 
noun.person | (negro, nsubj)  | noun.communication | (debut, obj) | the modern negro has not made a decisive debut into southern fiction 
noun.person | (she, nsubj)  | noun.object | (tent, obj) | for mr taylor's images and reflections she made some diaphanous tents that alternately hide and reveal the performer , and a girl's cape lined with grass 
noun.person | (cunningham, nsubj)  | noun.attribute | (use, obj) | the sequence is determined by chance , and mr cunningham makes use of any one of several chance devices 
noun.person | (they, nsubj)  | noun.attribute | (pretence, obj) | when it comes to this , i shall prefer emigrating to some country where they make no pretence of loving liberty -- to russia , for instance , where despotism can be taken pure , without the base alloy of hypocrisy '' ( his emphasis )
noun.entity | (it, nsubj)  | noun.cognition | (division, obj) | it made substantially the same division of power between the central and state governments , and among the executive , legislative and judicial branches 
noun.act | (sacrifice, nsubj)  | verb.social | (serve, obj) | they differed in the balance they believed essential to the sovereignty of the citizen -- but the supreme sacrifice each made served to maintain a still more fundamental truth : that individual life , liberty and happiness depend on a right balance between the two -- and on the limitation of sovereignty , in all its aspects , which this involves 
noun.location | (independence, nsubj)  | noun.act | (stride, obj) | but it has been during the last two centuries , during the scientific revolution , that our independence from the physical environment has made the most rapid strides 
noun.cognition | (one, nsubj)  | noun.act | (mistake, obj) | yet often fear persists because , even with the most rigid ritual , one is never quite free from the uneasy feeling that one might make some mistake or that in every previous execution one had been unaware of the really decisive act 
noun.person | (you, nsubj)  | noun.cognition | (sense, obj) | it is not a mess you can make sense of '' 
noun.person | (we, nsubj)  | noun.cognition | (sense, obj) | how can we make sense of this division ? ?
noun.person | (they, nsubj)  | noun.artifact | (fetish, obj) | and the life they lead is undisciplined and for the most part unproductive , even though they make a fetish of devoting themselves to some creative pursuit -- writing , painting , music 
noun.time | (blossom, nsubj)  | noun.person | (lady, obj) | hollyhock blossoms that , turned upside down , make pink-petticoated ladies ; ;
noun.food | (hay, nsubj)  | noun.feeling | (wish, obj) | if a child watched its progress he whispered , `` hay , hay , load of hay -- make a wish and turn away '' , and then stared rigidly in the opposite direction until the sound of the horses' feet returned no more 
noun.person | (he, nsubj)  | noun.communication | (claim, obj) | `` he made no claims to belong to the great and mighty of this earth '' 
adj.all | (former, nsubj)  | noun.act | (appearance, obj) | in town after town my companion pointed out the negro school and the white school , and in every instance the former made a better appearance ( it was newer , for one thing ) 
noun.person | (they, nsubj)  | noun.location | (desert, obj) | but i suspect that the old roman was referring to change made under military occupation -- the sort of change which tacitus was talking about when he said , `` they make a desert , and call it peace '' ( `` solitudinem faciunt , pacem appellant '' 
noun.artifact | (guest, nsubj)  | noun.person | (connection, obj) | for the occasion on which everyone already knows everyone else and the host wishes them to meet one or a few honored newcomers , then the `` open house '' system is advantageous because the honored guests are fixed connective points and the drifting guests make and break connections at the door 
noun.cognition | (one, nsubj)  | noun.person | (we, nsubj) | one of the obvious conclusions we can make on the basis of the last election , i suppose , is that we , the majority , were dissatisfied with eisenhower conservatism 
noun.person | (palmer, nsubj)  | noun.cognition | (series, obj) | attorney general palmer made a series of raids that sent more than 4,000 so-called radicals to the jails , in direct violation of their constitutional rights 
noun.entity | (what, obj)  | noun.person | (man, nsubj) | civilization is what man has made of himself 
noun.person | (i, nsubj)  | noun.communication | (judgment, obj) | i am not making a clinical judgment here , for such personal tragedies are real and are commonplace in the analyst's consulting room , but literature makes a different claim upon our sympathies than tragedy in life 
noun.act | (literature, nsubj)  | noun.communication | (claim, obj) | i am not making a clinical judgment here , for such personal tragedies are real and are commonplace in the analyst's consulting room , but literature makes a different claim upon our sympathies than tragedy in life 
noun.act | (externalization, nsubj)  | noun.communication | (difference, obj) | now we can argue that the irresistible fate of oedipus rex was nothing more than the irresistible unconscious longings of oedipus projected outward , but this externalization of unconscious conflict makes all the difference between a story and a clinical case history 
noun.person | (uncle, nsubj)  | noun.act | (gift, obj) | the child grows rich on his winnings and conspires with his uncle to make secret gifts of his money to his mother 
noun.person | (they, nsubj)  | noun.act | (war, obj) | `` it was then i knew that they were making war against man , the individual within ! !
verb.consumption | (require, nsubj)  | noun.group | (machinery, obj) | the axioms required to make the theoretical machinery operate are set out tersely and powerfully , so that all permissible operations within the theory can be traced rigorously back to these axioms , rules , and primitive notions 
noun.person | (she, nsubj)  | noun.communication | (picture, obj) | for rachel , conceded to be the prettiest of the szold girls -- and she did make a pretty picture sitting in the grape-arbor strumming her guitar and singing in her silvery tones -- there was no particular march counterpart ; ;
noun.person | (he, nsubj)  | noun.act | (mistake, obj) | this time he was making no mistake 
noun.group | (cloud, nsubj)  | noun.communication | (statement, obj) | cloud made an interesting statement in parting from his client : `` i wanted to be a lawyer , and mrs wright wanted me to be an avenging angel 
noun.person | (wright, nsubj)  | noun.communication | (statement, obj) | under this kind of pressure , it is not surprising that wright would make sweeping statements to the newspapers 
noun.person | (he, nsubj)  | noun.artifact | (plan, obj) | as he made plans for the new taliesin , wright also got on paper his conception of a cathedral of steel and glass to house a congregation of all faiths , and the idea for a planetarium with a sloping ramp 
noun.person | (lady, nsubj)  | noun.person | (you, nsubj) | a lady , you made clear to me both by precept and example , never raised her voice or slumped in her chair , never failed in social tact ( in heaven , for instance , would not mention st john the baptist's head ) , never pouted or withdrew or scandalized in company , never reminded others of her physical presence by unseemly sound or gesture , never indulged in public scenes or private confidences , never spoke of money save in terms of alleviating suffering , never gossiped or maligned , never stressed but always minimized the hopelessness of anything from sin to death itself 
noun.person | (he, nsubj)  | noun.event | (decision, obj) | carl has been married to paula for fifty-three years , and he has not made a single major decision without careful consideration and thorough discussion with his wife 
noun.person | (partner, nsubj)  | noun.event | (progress, obj) | in recent years america's partners and friends in western europe and japan have made great economic progress 
noun.person | (we, nsubj)  | adv.all | (abroad, obj) | our surplus from foreign business transactions has in recent years fallen substantially short of the expenditures we make abroad to maintain our military establishments overseas , to finance private investment , and to provide assistance to the less developed nations 
noun.location | (america, nsubj)  | noun.act | (contribution, obj) | we note that , first , america has already made great contributions in the past two years to the world's fund of knowledge of astrophysics and space science 
noun.person | (you, nsubj)  | noun.communication | (allegation, obj) | he claimed you made other slanderous allegations '' 
noun.person | (i, nsubj)  | noun.communication | (preparation, obj) | `` the matters to be considered are obviously of a grave character , and i therefore respectfully request that the hearing be postponed for two weeks in order that i might make adequate preparation '' 
noun.artifact | (caravan, nsubj)  | noun.possession | (way, obj) | all day long the caravan slowly made her way through the difficult passages 
noun.person | (chancellor, nsubj)  | noun.communication | (remark, obj) | on december 21 , the day that the irish house of commons petitioned for removal of sir constantine phipps , their tory lord chancellor , molesworth reportedly made this remark on the defense of phipps by convocation : `` they that have turned the world upside down , are come hither also '' 
noun.person | (i, nsubj)  | noun.communication | (check, obj) | but mercer's explanation was simple : `` i made out the check and carried it around a few days unsigned -- in case i lost it '' 
noun.person | (mercer, nsubj)  | adj.all | (another, obj) | when he remembered that he might have not signed the check , mercer made out another for the same amount , instructing the bank to destroy the other -- especially if he had happened to have absent-mindedly signed both of them 
noun.possession | (note, nsubj)  | noun.cognition | (wonder, obj) | the unfinished note , written in pencil upon the back of a used envelope , and addressed to the coroner , makes one wonder about many things : `` god forgive me for everything 
noun.person | (he, nsubj)  | noun.cognition | (one, obj) | i cannot remember dr gregory's reply , if , indeed , he made one 
noun.person | (he, nsubj)  | noun.object | (sound, obj) | he would not make a sound until the president had wakened and left for the office ; ;
noun.person | (president, nsubj)  | noun.person | (official, obj) | so the president would make a hearty breakfast official by inviting government officials to attend 
noun.person | (coolidge, nsubj)  | noun.person | (president, obj) | mama said that if presidents were supposed to be colorful , mr coolidge certainly made a good president 
noun.group | (maker, nsubj)  | noun.person | (mind, obj) | community decision makers must make up their minds whether a claim is acceptable to the larger community in terms of prevailing expectations regarding members of nation states 
noun.cognition | (one, nsubj)  | noun.person | (i, nsubj) | one , a reservation on the point i have just made , is the phenomenon of pseudo-thinking , pseudo-feeling , and pseudo-willing , which fromm discussed in the escape from freedom 
noun.object | (existence, nsubj)  | noun.communication | (difference, obj) | men seem almost universally to want a sense of function , that is , a feeling that their existence makes a difference to someone , living or unborn , close and immediate or generalized 
